{
  "sourceId":"ALC1737","sourcePageDigital":66,"sourcePagePrinted":52,"section":"part_ii","transcriptionType":"diplomatic","coverage":"full_page","scope":"printed_text",
  "text":"[continuación de 177] ... vos á los, las, los, amem: ellos á los, las, los, amim. V. g. yo amaré, ane erianaque: ellos los aman, amim eria: voſotros los mataſteis, amem ſuſuac: tu lo aborreces, aque hunahare: noſotros lo vimos, ate vitzaa: voſotros lo oiſteis, aquim hicac: él los hurtó, amubuac. No es fuerza atar el relativo a, vel am, al ſemipronombre, porque eſte ſe ſuele anteponer al relativo, como ſe dirá abaxo. Pero el relativo ſe junta ſiempre al verbo, v. g. ſino entráis en la Igleſia os azotaré: emchi neca Teopau quivamui ambemnaque, en donde el ſemipronombre ne precedió mucho antes del relativo am conjunto con el verbo vebnaque, que haze relacion de voſotros.\n\nColocacion del ſemipronombre perſonal.\n\n179. Es regla inevitable, que ſiempre ſe colocan los ſemipronombres perſonales en la oracion deſpues de la primera diccion de ella, v. g. no quiero comer, ca ne hibuavare: fleché á vn venado, mahta ne muhuc: beben agua, vaa te hibaie: no crees en Dios, ca te Dioſta ſuale. Eſto es con tanto rigor, que ſi no ſe halla en la oracion mas que el verbo, y el ſemipronombre, ſe coloca aquel deſpues del verbo, ora ſea activo, ora ſea neutro, v. g. yo como, hibuane: yo duermo, cotzene: yo eſtoy enfermo, cocorene.\n\n180. Y porque ſe vea quan infalible es eſta regla, ſuelen partir vn vocablo compueſto de dos dicciones, y poner el ſemipronombre deſpues de la primera parte de la compoſicion, v. g. yo eſtoy bueno, alaneia, [forma con semipronombre]; partióſe el vocablo alacia, compueſto de alaua, y eia; aunque como la diccion haze de dos vna diccion, ſe ſuele tambien no partir, v. g. quiero dormir, cotnevare, vel cotzvarene.\n\n181. Si la oracion no trae mas que relativo, verbo, y ſemipronombre, lo qual ſucede con verbos activos, ſe pone el ſemipronombre deſpues del relativo, v. g. amerta, yo le amo, y en eſte caſo ſe juntan los relativos con los ſemipronombres, vt ſupra. Pero ſi ay otras dicciones [continúa].",
  "lineBreakPolicy":"Rule numbers and subsection heading preserved; running prose normalized. Historical spelling retained.",
  "reviewStatus":"machine_corrected_unverified","humanVerified":false,
  "uncertainties":[{"token":"emchi neca Teopau quivamui ambemnaque","note":"Long rule-177 example needs second collation."},{"token":"[forma con semipronombre]","note":"Compound-word example in rule 180 is not securely legible in the current render."}],
  "materialNotes":[{"type":"bleed_through","note":"Light/moderate show-through.","transcription":null}],
  "provenance":{"derivedFrom":"ALC1737:digital-page-66;printed-page-52","agent":"GPT-5.6 Sol visual collation","method":"Full-page transcription with explicit unresolved forms; no independent human verification","processedAt":null}
}