{
  "sourceId": "ALC1737",
  "sourcePageDigital": 42,
  "sourcePagePrinted": 28,
  "section": "part_i",
  "transcriptionType": "diplomatic",
  "coverage": "full_page",
  "scope": "printed_text",
  "text": "ARTE DE LA LENGVA\n\ndel pronombre hi, hac, hoc, que es Hucari perdió la ri: inotquiua me conviene: emou ne iepſac vine à ti, en donde el tzi perdió el tzi con el pronombre imo, y el ui la i, con el pronombre emo: tuuriſi ne noca habló bien, en donde el adverbio tuuriſiua perdió el ua. Muchas prepoſiciones no pierden nada dentro de la oracion, v. g. vetzivo, vetana, uepa, po, y otras que dará el vſo.\n\n§. V.\nCOMPOSICION DE DICCIONES.\n\nNombres con nombres.\n\n101. En eſta lengua no ay compoſicion de nombres ſubſtantivos con ſubſtantivos, y aunque à alguno le parezca compoſicion eſta: umaſoveba, no lo es, ſino conſtruccion particular, fruta de arbol: cuta taca, que aſſi ſe conſtruyen los genitivos de poſſeſſion. Veaſe la ſyntaxis. Los P. P. Oton, y Cardenas dicen, que en eſta lengua todos los nombres compueſtos ſon adjetivos. Hoc ſuppoſito, ſiempre que quieren ſignificar el color de alguna coſa, vſan de compoſicion, poniendo primero el color, v. g. para decir coſa raſa, y colorada, dicen, colorada raſa, vel colorada en coſa raſa: ſic ſaiſalai, en donde el primer vocablo es ſiquiri colorado color: blanco en coſa raſa toſaſaiſalai, en donde el primer vocablo es toſali color blanco. Tambien vſan de compoſicion, quando vſan la figura de vn cuerpo, v. g. de vna muger alta, y delgada dicen ſira buahui: de vn hombre alto, y delgado dicen ſira toſolai.\n\nNombres con verbos.\n\n102. Componenſe nombres con verbos, aſſi adjetivos, como ſubſtantivos. Los adjetivos ſe ſuelen poner enteros, ò perdiendo la mitad en la compoſicion. Los ſubſtantivos ſe ponen ſiempre en el recto, y vnos, y otros antecedentes\n\nal\n",
  "lineBreakPolicy": "Continuation of rule 100, section and subsection headings, numbered rules and catchword are preserved; ordinary line wrapping is normalized within paragraphs. Historical spelling and visible long s are retained.",
  "reviewStatus": "machine_corrected_unverified",
  "humanVerified": false,
  "uncertainties": [
    {"token": "tzi perdió el tzi con el pronombre imo", "note": "Continuation of rule 100 is typographically difficult; the exact form names/segments require second collation.", "line": null},
    {"token": "umaſoveba", "note": "Example rejected by the source as true nominal composition; documentary form is provisional.", "line": null},
    {"token": "ſaiſalai / toſaſaiſalai", "note": "Color-composition examples are retained as working readings pending specialist review.", "line": null},
    {"token": "ſira buahui / ſira toſolai", "note": "Body-shape composition examples require second linguistic collation.", "line": null}
  ],
  "materialNotes": [
    {"type": "bleed_through", "note": "Moderate show-through is visible but the composition section is substantially legible.", "transcription": null}
  ],
  "provenance": {
    "derivedFrom": "ALC1737:digital-page-42;printed-page-28",
    "agent": "GPT-5.6 Sol visual collation",
    "method": "Full printed-text transcription from 300 dpi facsimile render with provider OCR used only as secondary comparison; no independent human verification",
    "processedAt": null
  }
}
