{
  "sourceId":"ALC1737","sourcePageDigital":103,"sourcePagePrinted":89,"section":"part_iii","transcriptionType":"diplomatic","coverage":"full_page","scope":"printed_text",
  "text":"[continuación de 282] ...\n\n283. No poder voluntariè, ſe explica con eſta partícula poeta, juntándola al verbo, en lugar del naque del futuro, v. g. no puedo ir, id eſt, no tengo gana, ó voluntad de ir, ca ne ſim poeta. Niega alguno, que ſabe alguna coſa que le preguntan, y le dice otro, ſí lo ſabes, pero no tienes gana de decirlo, cate noſtehoa poeta, ahunaqueria cari; y con eſte modo bien ſe pregunta á vno ſi tiene gana de confeſſarſe, [ejemplo cahíta]; ſi ha tenido intención de matar á alguno, [ejemplo cahíta]. Eſte poeta es compueſto de la prepoſición po, y el verbo eia, y aſſi ſe puede ir conjugando por ſus modos, y tiempos.\n\n284. El querer, ó no querer determinadamente lo ſignificado por el velle, vel nolle ſe explica con el verbo vare, querer, ó con la negativa ca vare, no querer.\n\nVERBOS IRREGULARES.\n285. Llámanſe aſſi los ſiguientes, porque aunque muchos de ellos tienen otro modo de ſignificaciones, y en ellas tienen todos los modos, y tiempos de la conjugación; pero en las ſignificaciones, que aqui ſe ponen, ſolo tienen los tiempos ſiguientes, y los que de ellos ſe forman.\n\n286. Primero: catec eſtar, para ſingular, to para plural: a eſte verbo ſe ſuele añadir de ordinario el locativo [ileg.]. Se conjuga aſſi, v. g. por el adverbio aman, allá. Preſente. Allá eſtoy, aman ne catec: allá eſtás, aman e catec: allá eſtá, aman catec. Plural. Allá eſtamos, aman te [forma]: allá eſtais, aman em [forma]: allá eſtán, aman im [forma]. Pretérito imperfecto, perfecto y pluſquam perfecto. Allá eſtaba, eſtuve, ó avia eſtado, aman ne catecai: allá eſtabamos, eſtuvimos, ó aviamos eſtado, [formas]. Futuro no tiene eſte, ſe ſuple por el verbo teja eſtar ſentado, para ſingular, y [forma] para plural, v. g. allá eſtaré, aman ne tebnaque: allá eſtaremos, [forma]. Imperativo no tiene, ſúpleſe por los verbos dichos, v. g. eſtate allá, [forma]: eſtaos allá, [forma].",
  "lineBreakPolicy":"Section heading and rule numbers preserved; paradigm prose normalized; unreadable cells are not reconstructed.",
  "reviewStatus":"unresolved","humanVerified":false,
  "uncertainties":[{"token":"[ejemplo cahíta]","note":"Examples under rule 283 require second collation."},{"token":"[ileg.]","note":"Locative element named in rule 286 is not secure in current pass."},{"token":"[forma]","note":"Several plural/suppletive paradigm cells require dedicated collation."}],
  "materialNotes":[{"type":"bleed_through","note":"Moderate show-through; VERBOS IRREGULARES heading is clear.","transcription":null}],
  "provenance":{"derivedFrom":"ALC1737:digital-page-103;printed-page-89","agent":"GPT-5.6 Sol visual collation","method":"Full-page transcription from facsimile with parsed text as secondary comparison; no independent human verification","processedAt":null}
}