{
  "sourceId":"ALC1737","sourcePageDigital":124,"sourcePagePrinted":110,"section":"part_iv","transcriptionType":"diplomatic","coverage":"full_page","scope":"printed_text",
  "text":"[continuación de 344 — Adverbia motus] ... vnos tras otros, [formas]; como los peleados quando andan agua arriba, y no en lo hondo, [forma]; ſuperficie tenus como quando llovizna, [formas]; arrancando los pies como quando va de mala gana, [forma]; arrancando vn pie como cojeando, [forma]; haziendo ruido con los pies, [formas]; haziendo ruido con los pies como quando ſe anda por arena, [forma]; ruido como con caſcabeles, [forma]; hundiendoſe vn pie en algun agujero, [formas], v. g. cayó, ſe hundió, [ejemplo]; andar de puntillas, [variantes]; arraſtrando los pies mui deſpacio, [variantes]; meneando con ambos brazos, [forma].\n\nTemporis.\n345. Preſto, ſepi, ſepeliua, alepana, [variantes]: v. g. preſto me he de ir, [ejemplo]: preſto, id eſt, celeriter, [formas]: no ſe dan priſa, [ejemplo]: no ceſſan de hablar, [ejemplo]: mui deſpacio, ó mucho tiempo, [formas]. Agora, heni, ave, [variantes]: v. g. note, deſpues; no te detengas, [ejemplo]. Heni ſignifica eſte dia, ó agora; u hoy; los demás ſignifican lo que de ordinario decimos agora. Poco ha, poquito ha, no ha nada: agora poco ha, id eſt, otro dia diſtinto, no el miſmo dia, [formas]: de aquí á vn poco, [formas]: deſpues, [formas]: oy y deſpues, [forma]: ayer, [forma]: antes de ayer, [forma]: tres dias ha, [formas]: mañana, [forma]: paſſado mañana, [formas]: ſolamente de aquí á tres dias, [formas]: agora, [forma]: de aquí á vn poquito, [forma]: mucho tiempo ha, [formas]: por eſte tiempo, iehuri, v. g. por eſte tiempo, ó haſta eſte tiempo caſéme, [continúa].",
  "lineBreakPolicy":"Motion-list continuation and Temporis heading/rule 345 preserved; exact variant lists are retained only when secure.",
  "reviewStatus":"unresolved","humanVerified":false,
  "uncertainties":[{"token":"motion forms","note":"Multiple onomatopoeic/manner forms need token-level second collation."},{"token":"temporal variants","note":"Rule 345 contains a very dense variant inventory requiring dedicated lexical collation."}],
  "materialNotes":[{"type":"bleed_through","note":"Moderate show-through; Temporis heading and temporal sequence are clear.","transcription":null}],
  "provenance":{"derivedFrom":"ALC1737:digital-page-124;printed-page-110","agent":"GPT-5.6 Sol visual collation","method":"Full-page structural/diplomatic transcription from facsimile with parsed text as secondary comparison; no independent human verification","processedAt":null}
}