{
  "sourceId":"ALC1737","sourcePageDigital":80,"sourcePagePrinted":66,"section":"part_iii","transcriptionType":"diplomatic","coverage":"full_page","scope":"printed_text",
  "text":"ARTE DE LA LENGVA\n\n[continuación de 215] [ejemplo cahíta] vachi co: no te mandara azotar, ſi tuvieras buen corazón, cañe emchi vebte [ileg.], emchi tuuric hiepfico. Alguna vez vſan en oraciones de dos ſupueſtos de la partícula teca para los que traen la condicional ſi, v. g. Dios te caſtigará, ſi pecares, Dios emchi hiocotetuanaque, emchi catunſiane teca. Si bien jamás parece vſarſe del teca en la primera perſona para oraciones de dos ſupueſtos.\n\nEpitome de todo lo dicho.\n216. Con oraciones de vn ſupueſto la partícula ſi, antes vſan para todos tiempos de eſta partícula teca, añadida al preſente de activa, y paſſiva. Con oraciones de vn ſupueſto las partículas como, quando, aunque, deſpues, vſan para todos tiempos de eſta partícula cari, y para el pluſquam perfecto cacari, añadidas al preſente de activa, y paſſiva. Con oraciones de dos ſupueſtos todas las dichas partículas ſi, antes, como, quando, aunque, deſpues, vſan de eſta partícula yo para preſente, y futuro; de eſta, co, para pretérito, y de eſta, caco, para pluſquam perfecto, añadidas todas al preſente de activa, y paſſiva.\n\n217. Los verbos poſſeſſivos, y los demás acabados en c en oraciones de vn ſupueſto, no reciben nada con las partículas ſi, y antes, ſino que el miſmo preſente ſirve á todos tiempos. Con las partículas como, quando, aunque, deſpues reciben el cari en el preſente para todos tiempos, y el cacari para pluſquam perfecto. En oraciones de dos ſupueſtos forman todos los tiempos que traen todas las dichas partículas con ſolo co añadido al preſente.\n\n218. A la partícula antes, ſe añade ſiempre antecedentemente el adverbio queheri, vel caheri, que quiere decir aun no. A la partícula aunque, ſe añade ſiempre antecedentemente eſte adverbio mautzi, vel mautzí, que ſignifica aunque. A la partícula deſpues, ſe añade en lugar del naque del futuro eſta partícula ſu, la qual tiene paſſiva ſuua, y ſobre el ſu, y el ſuua ſe ponen las terminaciones de los tiempos, como [continúa en p. 81].",
  "lineBreakPolicy":"Historical heading Epitome and rule numbering preserved; running line breaks normalized.",
  "reviewStatus":"unresolved","humanVerified":false,
  "uncertainties":[{"token":"[ejemplo cahíta] vachi co","note":"Opening continuation of rule 215 is not fully secure."},{"token":"vebte [ileg.]","note":"Verb form in the first continued example requires second collation."}],
  "materialNotes":[{"type":"bleed_through","note":"Minor show-through; summary rules 216–218 are visually clear.","transcription":null}],
  "provenance":{"derivedFrom":"ALC1737:digital-page-80;printed-page-66","agent":"GPT-5.6 Sol visual collation","method":"Full-page transcription from facsimile with parsed text as secondary comparison; no independent human verification","processedAt":null}
}