{
  "sourceId":"ALC1737","sourcePageDigital":113,"sourcePagePrinted":99,"section":"part_iv","transcriptionType":"diplomatic","coverage":"full_page","scope":"printed_text",
  "text":"[continuación de 311 — TABALA] ... contigo, con ninguno otro puedo andar, [ejemplo cahíta]: fuera de Dios, ſino es á Dios, no ſe ha de amar otra coſa, [ejemplo]. Segundo ſignifica con eſta prepoſicion á, y el tabala lo miſmo que apartarſe de él, dexóle, [forma]: anda apartado de mi, inotzi tabala uerama.\n\nVEPA.\n312. Eſta ſe junta á los ablativos de los pronombres mediante el tzi, y con nombres rige accuſativo: ſignifica lo miſmo que ſuper, v. g. eſtá colgado, ó pendiente ſobre mi, inotzivepa [forma]: ſobre la caſa, [forma]: ſobre la meſa, [forma].\n\nVETUCUNI.\n313. Eſta ſe junta á los ablativos de los pronombres mediante el tzi, y con nombres rige nominativo: ſignifica debaxo, correſponde á ſubter, v. g. debaxo de él, [forma]: debaxo del árbol, cutavetucuni: debaxo de mi, inotzivetucuni. Suelen quitarle el ve por abreviacion, y vſan de ſolo el tucuni, v. g. arrojóſe á ſus pies, y los beſó, [ejemplo cahíta].\n\nVEBUILI.\n314. Eſta ſe junta á los ablativos de los pronombres mediante el tzi, y con nombres rige accuſativo: ſignifica cerca, junto, correſponde á iuxta: anduve lexos de él, id eſt, no cerca de él, ca ne aietzi vebuili ueramac: te ſentarás fuera de mi, [ejemplo]: cerca de las milpas, [forma]: amo á Dios ſobre todas las coſas, [ejemplo], quiere decir, nada ay, que yo ame ſino á Dios. Eſte vebuili es mui vſado en Hiaqui.\n\nYEUI.\n315. Eſta ſe junta á los ablativos de los pronombres [continúa].",
  "lineBreakPolicy":"Continuation and preposition headings/rules preserved; long examples normalized or unresolved.",
  "reviewStatus":"unresolved","humanVerified":false,
  "uncertainties":[{"token":"inotzivepa","note":"Surface attachment of tzi+vepa should be rechecked."},{"token":"[ejemplo cahíta]","note":"Several long examples require second collation."}],
  "materialNotes":[{"type":"bleed_through","note":"Moderate show-through; VEBUILI statement about Hiaqui is visually clear.","transcription":null}],
  "provenance":{"derivedFrom":"ALC1737:digital-page-113;printed-page-99","agent":"GPT-5.6 Sol visual collation","method":"Full-page transcription from facsimile with parsed text as secondary comparison; no independent human verification","processedAt":null}
}