{
  "sourceId":"ALC1737","sourcePageDigital":119,"sourcePagePrinted":105,"section":"part_iv","transcriptionType":"diplomatic","coverage":"full_page","scope":"printed_text",
  "text":"[continuación de 327 — CUTZI] ... muchos lugares, [formas]; en vn lugar, ó en otro, [formas].\n\nCAINECU.\n328. Eſta ſe halla con ſolos nombres, rige caſo obliquo: ſignifica á eſcondidas, ó ſin ſer viſto, ó ſentido, v. g. no puedes hazer coſa á eſcondidas de Dios, ó ſin ſer viſto, ó ſentido de Dios, cate hita homachi, Dioſta cainecu: ſin ſer viſto, ó ſentido de la gente ſe huyó, yoremta cainecu buttec.\n\nTUHTIUA, CAMTIUA.\n329. Eſtas dos ſe hallan con nombres, rigen accuſativo, y tambien ſe juntan á verbos, y adverbios: ſignifican haſta, ſive loci, ſive temporis, correſponden al uſque latino, v. g. haſta que ſe acabe el mundo, [ejemplo]: haſta el palo, cutata tuhtiua, vel camtiua. Suelen decirſe eſtas oraciones por eſte adverbio [forma], que ſirve á ſolos verbos y ſignifica haſta, v. g. haſta mi muerte, [ejemplo]. A eſtas prepoſiciones ſe les añade eſta partícula hum antepueſta.\n\nPrepoſiciones, cuyo vſo parece adverbial.\n\nAMAPO.\n330. Eſta parece compueſta del nombre ama, que es la eſpalda, y la prepoſicion po: ſignifica á tergo, retro, poſt, y aunque rige obliquo, es genitivo de poſſeſſion regido del nombre ama, v. g. á las eſpaldas, ó detrás de la caſa, cata amapo: deſpues de mi, id eſt, á mis eſpaldas, inoamapo.\n\nEULI, vel EUILI, vel EUITZI.\n331. Eſta ſignifica á eſcondidas, correſponde al clam: no parece regir caſo alguno de nombre; ſolo ſe practica como adverbio, porque aunque en las oraciones en que ſe halla parece aver algun caſo, es regido del verbo á quien ſe junta el euli, v. g. el Diablo nos aſſecha á eſcondidas [continúa].",
  "lineBreakPolicy":"Continuation, subsection heading and rules preserved; source classifications of preposition/adverb retained.",
  "reviewStatus":"unresolved","humanVerified":false,
  "uncertainties":[{"token":"adverbio [forma] in rule 329","note":"Adverb used for 'hasta' requires second collation."},{"token":"EULI/EUILI/EUITZI","note":"Variant headwords are preserved but should be rechecked for exact historical spelling."}],
  "materialNotes":[{"type":"bleed_through","note":"Moderate show-through; subsection transition is clear.","transcription":null}],
  "provenance":{"derivedFrom":"ALC1737:digital-page-119;printed-page-105","agent":"GPT-5.6 Sol visual collation","method":"Full-page transcription from facsimile with parsed text as secondary comparison; no independent human verification","processedAt":null}
}