{
  "sourceId":"ALC1737","sourcePageDigital":116,"sourcePagePrinted":102,"section":"part_iv","transcriptionType":"diplomatic","coverage":"full_page","scope":"printed_text",
  "text":"[continuación de 321 — VETANA] ... ivotana, de aquí, ó de eſta parte: itotana, de eſta parte de donde eſtamos, v. g. partióſe de aquí, ivotana uauaſec. Deſde que te confeſſaſte haſta aora qué has hecho? [ejemplo cahíta].\n\nMECA.\n322. Eſta es prepoſicion, y es adverbio, juntaſe con los ablativos de los pronombres, vnas vezes por ſi ſola, otras mediante el tzi, con nombres rige obliquo: ſignifica lexos, correſponde á procul, v. g. vete lexos de mi, inomecare ſime, vel inotzi mecare: lexos de la caſa, cata meca.\n\nPrepoſiciones, que rigen genitivo de pronombres.\n\nUAHUIA.\n323. Eſta no ſolo rige genitivo de pronombre, ſino tambien de los nombres á quien ſe junta: ſignifica dentro, correſponde al intra: dentro de mi, inuahuia: dentro de ti, emuahuia: dentro de la tierra, buiata uahuia: dentro del alma, hiepſita uahuia: dentro de la ſierra, cauita uahuia. Suelen juntarle la prepoſicion po, y entonces ſignifica en el interior, lo que decimos intrinſecus, ó en las entrañas, v. g. en las entrañas de la tierra, ó en el corazón de la ſierra, buiata uahuiapo, vel cauita uahuiapo. Eſte modo de hablar ſe frequenta mas con el nombre de ſuua, que ſignifica el corazón, y la prepoſicion po, v. g. en lo interior de la olla, [ejemplo]: en las entrañas de la tierra, buiata ſuuapo: en el corazón de la ſierra, cauita ſuuapo. Tambien vſan con gala del uahuia para decir interiormente lo quiſe, lo penſé, &c. v. g. me enojé interiormente, [ejemplo]: lo deſſeé interiormente, [ejemplo]: aſſi lo intenté, ó pretendí interiormente, [ejemplo].\n\nHIPITCU.\n324. Eſta rige genitivo de pronombre, y nombres: ſignifica [continúa].",
  "lineBreakPolicy":"Continuation and new government subsection preserved; headings/rule numbers retained; running lines normalized.",
  "reviewStatus":"unresolved","humanVerified":false,
  "uncertainties":[{"token":"inomecare / inotzi mecare","note":"Alternative MECA forms should be second-collated for exact spacing/spelling."},{"token":"[ejemplo]","note":"Several idiomatic UAHUIA examples require second collation."}],
  "materialNotes":[{"type":"bleed_through","note":"Moderate show-through; government subheading and UAHUIA/HIPITCU headings clear.","transcription":null}],
  "provenance":{"derivedFrom":"ALC1737:digital-page-116;printed-page-102","agent":"GPT-5.6 Sol visual collation","method":"Full-page transcription from facsimile with parsed text as secondary comparison; no independent human verification","processedAt":null}
}