{
  "sourceId":"ALC1737","sourcePageDigital":68,"sourcePagePrinted":54,"section":"part_ii","transcriptionType":"diplomatic","coverage":"full_page","scope":"printed_text",
  "text":"[continuación de 185] tiene buen veſtido, tuurim ſupec: de la miſma manera con nombres, que no tienen plural; y aſſi no diremos mucho mais, burum vachi, ſino buru vachi; porque vachi carece de plural; tiene mucho mais, buru vachec: determinanſe nombres ſemejantes á ſentido de ſingular, ó plural con adjetivos, que ſignifiquen multitud, ó ſingularidad, v. g. ſenuli vno ſolo, ſe declina, y tiene plural; y aſſi para decir vn ſolo veſtido bueno, ſenulim tuurim ſupem: tiene vn ſolo veſtido bueno, ſenulim tuurim ſupec.\n\n186. En quanto al caſo conciertan de modo, que aunque el ſubſtantivo ſe haga verbo, ſe pone el adjetivo en el caſo en que ſe avia de poner el ſubſtantivo ſi ſe expreſſara, ó no ſe huviera hecho verbo. El verbo poſſeſſivo rige accuſativo vt ſupra in prima parte: para decir tiene lindo cabello, haziendoſe el nombre tzoni verbo poſſeſſivo, ſe dirá, alamachic tzoni[c], en donde el adjetivo alamachic es accuſativo: amo al bueno, tuuric ne eria, el adjetivo tuuric es accuſativo, porque es el caſo en que ſe avia de poner el ſubſtantivo ſi ſe expreſſara.\n\n187. El relativo, y antecedente conciertan en numero, y caſo como los adjetivos, no ſolo entiendo aquí por relativos las notas relativas a, vel am, que eſtas ſiempre ſon de accuſativo, y conciertan con el accuſativo de perſona, ó coſa de que hazen relacion: ſino tambien entiendo por relativos los demás pronombres enteros, que no ſon perſonales, v. g. ſi yo digo buſco á vna perſona: ſenuc ne yoremta harina, ſi me preguntan por el pronombre demonſtrativo, ſi es el que eſtá preſente, dirán, huca hani? Reſpondiendo diré, acari abuam, en donde huca, y acari ſon accuſativos de ſingular, concertando con yoremta: nueſtras almas ſon eternas, nunca ſe acaban, por lo qual tenemos obligacion de guardarlas: itom hiepſi ca ſuſubine bulen ſame aſeiua ſaiua; en donde el relativo es a, de ſingular y no am, de plural; porque hiepſi, que es ſu antecedente no tiene plural. Adviertaſe, que aqui hiepſi eſtá en nominativo, y con toda la nota [continúa].",
  "lineBreakPolicy":"Rule numbering preserved; running prose normalized within paragraphs. Historical spelling and long s retained where legible.",
  "reviewStatus":"machine_corrected_unverified","humanVerified":false,
  "uncertainties":[{"token":"tzoni[c]","note":"Final consonant of possessive verb is visually faint; expected form is not silently imposed."},{"token":"itom hiepſi ca ſuſubine bulen ſame aſeiua ſaiua","note":"Long example requires second linguistic collation."}],
  "materialNotes":[{"type":"bleed_through","note":"Moderate show-through; lower lines slightly crowded.","transcription":null}],
  "provenance":{"derivedFrom":"ALC1737:digital-page-68;printed-page-54","agent":"GPT-5.6 Sol visual collation","method":"Full-page transcription from facsimile with explicit uncertainties; no independent human verification","processedAt":null}
}