{
  "sourceId":"ALC1737","sourcePageDigital":132,"sourcePagePrinted":118,"section":"part_iv","transcriptionType":"diplomatic","coverage":"full_page","scope":"printed_text",
  "text":"[continuación de 370]\n\nCopulativa, & diſjunctiva.\n371. Al y, ó & latino copulativo correſponde eſta [forma], etiam, huneri, y ſuri; pero mas propriamente al etiam, ó al y tambien caſtellano: v. g. ſaludando á vno, luego reſponde [ejemplo], y tu tambien tienes ſalud? Adviertaſe en el vſo del huneri, y ſuri, que el ſuri ſolo ſe vſa con verbos; el huneri con verbos, y nombres: v. g. le darás mais, y le darás frijol, y le darás tambien, ó tabaco, [ejemplo cahíta].\n\n372. Item ſe advierta en el modo de hablar, porque en compoſicion el ſuri pierde la ri, ó aunque no ſea en compoſicion la pierde en medio de la oración ſiguiéndoſele otra diccion, que empiece con conſonante, y aſſi queda eſta partícula ſu, la qual ſuele equivocar con el ſuli, que ſignifica ſolamente, ó con la partícula ſu perfectionis, vel complementi: v. g. ſolamente ſe me dio mais, vachiſu micuac: ya ſe le dio mais á todos, vachita micua [forma].\n\n373. Eſta ientoc, vel [variantes] ſignifica, y á demás de eſto; tambien ſignifican iterum: v. g. y á demás, qué otra coſa hiziſte? [ejemplo]: dale mas, vel dale otra vez, aqui mica ientoco.\n\nINTERJECCIONES.\nNo ſe hallan en los Artes, el vſo las dará.\n\nFIN DEL ARTE.",
  "lineBreakPolicy":"Closing conjunction rules, INTERJECCIONES notice and FIN DEL ARTE preserved; uncertain forms not reconstructed.",
  "reviewStatus":"unresolved","humanVerified":false,
  "uncertainties":[{"token":"copulative initial form","note":"First Cahíta equivalent in rule 371 is not secure in current pass."},{"token":"ientoc variants","note":"Variant forms in rule 373 require second collation."}],
  "materialNotes":[{"type":"other","note":"Decorative ornaments and FIN DEL ARTE visually mark closure of the grammar on printed p.118.","transcription":null}],
  "provenance":{"derivedFrom":"ALC1737:digital-page-132;printed-page-118","agent":"GPT-5.6 Sol visual collation","method":"Full-page structural/diplomatic transcription from facsimile with parsed text as secondary comparison; no independent human verification","processedAt":null}
}