{
  "sourceId":"ALC1737","sourcePageDigital":121,"sourcePagePrinted":107,"section":"part_iv","transcriptionType":"diplomatic","coverage":"full_page","scope":"printed_text",
  "text":"[continuación de 336 — NASUCI] ... de noſotros, itom naſuci: entre las piedras, tetamnaſuci: entre los arboles, cuamamnaſuci; y aunque algunas vezes el nombre á quien ſe junta eſté en caſo obliquo no es regido del naſuci, ſino de algun verbo, ó otra prepoſicion [explicación].\n\nNANTENA, NANAUTZI.\n337. Eſtos ſon dos adverbios: ſignifican por iguales partes, tanto, ó tantos de vna parte, como de otra, v. g. [ejemplo]: eſtán por iguales partes parados, id eſt, tantos aquí, como acá, nantena [forma].\n\nNOUASI.\n338. Parece adverbio, vnas vezes ſe halla con el nombre en nominativo, otras con el nombre ya conjunto con otra prepoſicion: ſignifica haſta la mitad, v. g. haſta la mitad del camino, [forma]: haſta la mitad de la caſa, [forma].\n\nSEPA.\n339. Eſte parece adverbio de diſtancia, correſponde al procul, v. g. donde, lexos, ó en qué parte de diſtancia le encontraſte? [ejemplo cahíta].\n\nVITEC, VITZACARI, SIMALA, HALTIUA.\n340. Eſtos dos primeros ſon adverbios gerundivos, ſignifican azia, verſus, v. g. fué azia allá, [formas]; azia mi, ino vitzacari, id eſt, mirándome, ó mirando azia mi. El tercero ſimala parece adverbio, ſignifica junto, cerca, v. g. vive junto á mi caſa, [ejemplo]: ven junto, ó cerca de mi, [ejemplo]. El quarto haltiua es adverbio, correſponde al pedetentim, v. g. ven paſſo á paſſo, haltiua e ueie. Hæc de præpoſitionibus ſatis.\n\nAD- [catchword].",
  "lineBreakPolicy":"Adverb headings/rules and final Part-IV preposition-section closure preserved; running lines normalized.",
  "reviewStatus":"unresolved","humanVerified":false,
  "uncertainties":[{"token":"NANTENA/NANAUTZI examples","note":"Exact historical forms require second collation."},{"token":"VITEC/VITZACARI examples","note":"Several directional examples require second collation."}],
  "materialNotes":[{"type":"bleed_through","note":"Moderate show-through; Latin closure `Hæc de præpoſitionibus ſatis` and catchword AD- are visible.","transcription":null}],
  "provenance":{"derivedFrom":"ALC1737:digital-page-121;printed-page-107","agent":"GPT-5.6 Sol visual collation","method":"Full-page transcription from facsimile with parsed text as secondary comparison; no independent human verification","processedAt":null}
}