{
  "sourceId":"ALC1737","sourcePageDigital":107,"sourcePagePrinted":93,"section":"part_iv","transcriptionType":"diplomatic","coverage":"full_page","scope":"printed_text",
  "text":"[continuación de 293 — UI] ... zelos, no ſon bien afectos para con los Padres, [ejemplo cahíta]. Adviertaſe por remate de eſta prepoſicion, que con nombres de plural acabados en m, añade á la m vna e para juntarſe con el nombre en qualquiera de las dichas ſignificaciones, v. g. Torimeui á Torin: Bahcomeui á Bahcon.\n\nTZI.\n295. Eſta partícula tzi es tan frequente como la de arriba: tiene varias ſignificaciones, y juntaſe á los pronombres en el ablativo, y á ſolos ſubſtantivos en nominativo. Primero ſignifica en quietis, correſponde al in latino locus in quo; pero con eſta advertencia, que en eſta accepcion de in quietis ſolo ſe vſa con nombres, que no tienen ſignificado de interioridad, profundidad, ó concavidad, aunque la coſa eſté ſituada en lo interior, ó profundo; y ſi la tienen, ó ſon convexas, ó eſphericas, ó profundas ſe vſa del tzi hablando de la parte externa, pero no de la intima, v. g. en la meſa, meſatzi: en el palo, cutatzi: en la cabeza externa ſuperficie, cobatzi: en el alma, hiepf̉itzi: en ti, emtzi: en el rio, haquitzi, hoc eſt, en las riberas, ó margenes, no del agua, que como tiene profundidad ſe dirá vaapo.\n\n296. Tambien eſta prepoſicion tzi en eſta ſignificacion de in quietis, correſponde propriamente á lo que llamamos dativo de adquifition, ó atribucion, v. g. le eſtá bien, ó le es conveniente, illi oportet, vel convenit: con el tzi ſe dice aſſi: aietzituuri, vel aietzituua: como ſi dixeſſe, in ipſo eſt conveniens, vel placens, eſtá bien en ti, es conveniente para ti, ó en ti: los Chriſtianos honran á Dios en los Padres, [ejemplo cahíta]. Adviertaſe, que tambien eſta prepoſicion tzi añade vna e á los nombres de plural acabados en m para juntarſe con ellos, v. g. en los Padres, Padremetzi: en la gente, ioremtametzi.\n\n297. Segundo ſignifica por, correſponde al ab latino, v. g. [ejemplo]: ſe enojan, ó riñen por milpas, [ejemplo]. Tercero ſignifica para, v. g. para los enfermos, [continúa].",
  "lineBreakPolicy":"Preposition heading, rule numbers and numbered senses preserved; running line breaks normalized; long examples unresolved where necessary.",
  "reviewStatus":"unresolved","humanVerified":false,
  "uncertainties":[{"token":"295","note":"Visible facsimile supports 295 at TZI; no preceding visible 294 has yet been located. Possible numbering omission is retained as an editorial incidence pending second collation."},{"token":"[ejemplo cahíta]","note":"Several examples require second collation."}],
  "materialNotes":[{"type":"bleed_through","note":"Moderate show-through; TZI heading and rule sequence remain readable.","transcription":null}],
  "provenance":{"derivedFrom":"ALC1737:digital-page-107;printed-page-93","agent":"GPT-5.6 Sol visual collation","method":"Full-page transcription from facsimile with parsed text as secondary comparison; no independent human verification","processedAt":null}
}