{
  "sourceId":"ALC1737","sourcePageDigital":67,"sourcePagePrinted":53,"section":"part_ii","transcriptionType":"diplomatic","coverage":"full_page","scope":"printed_text",
  "text":"[continuación de 181] ... [si hay otras dicciones] el ſemipronombre, fino que ſiempre ſe pone deſpues de la primera diccion, v. g. amaré á mis enemigos como á mi miſmo, conforme al precepto de Dios: [ejemplo cahíta].\n\n182. Aun juntos eſtos ſemipronombres con los reflexivos, ſi en la oracion ay otras dicciones antecedentes al verbo con quien ſe junta el reflexivo, entonces el ſemipronombre ſe pone deſpues de la primera diccion antecedente, v. g. ayer quando le decia Muſta, no eſtaba en mis ſentidos: [ejemplo cahíta].\n\n183. Algunas vezes quando la oracion es larga, aviendo precedido el ſemipronombre deſpues de la primera diccion, y viniendo lexos el verbo, ſuelen juntarle otra vez el ſemipronombre para mas claridad de la perſona que haze, v. g. amaré con todo mi coraçon, y ſobre todas las coſas haſta morir, á Dios todo poderoso, que hizo el Cielo, y la tierra, y me redimió: [ejemplo cahíta extenso].\n\n184. Con la conjuncion ido, que en la lengua es bulen, vel aſſim, ſe componen los ſemipronombres perſonales, del modo ſiguiente: y por eſto yo, bulenanne: y por eſto tu, bulenen: y por eſto él, bulenan: y por eſto noſotros, bulenſante: y por eſto voſotros, bulenſem: y por eſto ellos, bulenſam; eodem modo ſe compone el aſſim.\n\nCONCORDANCIAS.\n\n185. Conciertan el ſubſtantivo, y adjetivo en numero, y caſo, de tal ſuerte, que ſi el ſubſtantivo no tiene ſingular, aunque ſe hable de vna coſa ſola, ſe pone el adjetivo en plural, aunque el ſubſtantivo ſe haga verbo poſſeſſivo, v. g. ſupem veſtido, no tiene ſingular, y aſſi el adjetivo ſe pondrá con él en plural, v. g. bueno veſtido, tuurim ſupem [continúa].",
  "lineBreakPolicy":"Rule numbers and CONCORDANCIAS heading preserved; long examples are represented as explicit unresolved spans rather than silently reconstructed.",
  "reviewStatus":"unresolved","humanVerified":false,
  "uncertainties":[{"token":"[ejemplo cahíta]","note":"Examples in rules 181–182 are not sufficiently legible in current render for safe full transcription."},{"token":"[ejemplo cahíta extenso]","note":"Long rule-183 example is intentionally withheld pending second collation."},{"token":"bulenanne/bulenen/bulenan/bulenſante/bulenſem/bulenſam","note":"Conjunction+semipronoun forms are provisional readings from image/OCR collation."}],
  "materialNotes":[{"type":"bleed_through","note":"Heavy show-through and small type affect examples.","transcription":null}],
  "provenance":{"derivedFrom":"ALC1737:digital-page-67;printed-page-53","agent":"GPT-5.6 Sol visual collation","method":"Full-page structural transcription with unresolved examples explicitly marked; no independent human verification","processedAt":null}
}