{
  "sourceId":"ALC1737","sourcePageDigital":131,"sourcePagePrinted":117,"section":"part_iv","transcriptionType":"diplomatic","coverage":"full_page","scope":"printed_text",
  "text":"[continuación de 367] ... bien: v. g. aſſi tambien habló, [ejemplo]. Huneri ſignifica tambien: v. g. y voſotros tambien, [ejemplo]. Huni ſignifica aſſi, ſimilative: v. g. no hable aſſi, ca ne bulen noca.\n\n368. Mautzi ſignifica aunque, que importa, maſque, no importa: v. g. aunque ſeas aviſado hazes como ſi no fueras aviſado, [ejemplo]. Bien ſe ſuelen juntar el vena ſic, mautzuvena: v. g. aunque no me caſtiguen, yo os amo, [ejemplo]. Con eſtas dos conjunciones huneri y ſuri ſignifican tambien el aunque: v. g. aunque te riño te amo, [ejemplo]; aunque por mas, v. g. azotéle, pero no mucho, [ejemplo]. Colocanle tambien al fin de la oración: Dios no luego arroja los malos al infierno, aunque deſpues de muertos aſſi lo hará, [ejemplo]. Tepa ſignifica pero, mas, ſino que: v. g. no lo hizo, pero lo dice aſſi, [ejemplo].\n\nDubitantis.\n369. Hani quizás, ó por ventura: v. g. quizás no lloverá? [ejemplo]. Reſponderá otro, porque del duban le vía en reſpueſta, no porque de ſolo el hani: quizás me ſocorrerá? [ejemplo]. Inucam ſignifica quizás, v. g. halló vn Indio alguna coſa, que no conoce, y cogiéndola dirá: eres quizá alguna coſa de eſtima? [ejemplo]. Quiza me caſaré? [ejemplo].\n\n370. Tepaſin ſignifica ni aun: v. g. los que creen en Dios ſintiendo en ſus pecados, no pueden eſtar con ellos vn mes ni aun vn ſolo dia, [ejemplo]. Co- [continúa].",
  "lineBreakPolicy":"Rule 367 continuation, rule 368, Dubitantis 369 and rule 370 start preserved; long examples remain unresolved.",
  "reviewStatus":"unresolved","humanVerified":false,
  "uncertainties":[{"token":"Mautzi/mautzuvena","note":"Exact inflected/combined source forms require second collation."},{"token":"Tepaſin","note":"Rule 370 headword should be second-collated for exact historical spelling."}],
  "materialNotes":[{"type":"bleed_through","note":"Moderate show-through; Dubitantis heading and rule numbering clear.","transcription":null}],
  "provenance":{"derivedFrom":"ALC1737:digital-page-131;printed-page-117","agent":"GPT-5.6 Sol visual collation","method":"Full-page structural/diplomatic transcription from facsimile with parsed text as secondary comparison; no independent human verification","processedAt":null}
}