{
  "sourceId":"ALC1737","sourcePageDigital":73,"sourcePagePrinted":59,"section":"part_iii","transcriptionType":"diplomatic","coverage":"full_page","scope":"printed_text",
  "text":"196. Segundo: ſirve de imperativo tambien el futuro imperfecto, y entonces tiene todas las perſonas aſſi por activa, como por paſſiva, v. g. ame yo, vel yo amaré, ane erianaque: ſea yo, vel ſeré amado, erianauane. Tercero: quando ſe manda lo que el otro dixo que queria hazer, ó tenia mandato para ello, ſe añade al imperativo principal eſta particula ma, v. g. dixo vno, que queria irſe, á eſte tal bien ſe le reſponde mandándole que ſe vaya, ſimemae. A vn cocinero de poſoli, bien ſe le dirá mandándole hazer [ejemplo]: [forma]. Por el verbo de la conjugacion de Eria: ama tu, aque eriama: ame aquel, a eriama: amad voſotros, aquem eriamabu: amen aquellos, aquim eriamabu. Paſſiva. Se tu amado, eriauamae: ſea aquel amado, eriauama: ſed voſotros amados, eriauamabuem: ſean aquellos amados, eriauamabuim.\n\n197. Quarto: quando ruegan, y quieren inclinar la perſona á ſus ruegos, vſan de mautzi, anteponiéndolo al verbo con el imperativo principal, v. g. perdóname Padre te ſuplico, mautzi e Pare ne hiocore; ama tu te ruego, mautzi e eria: ame aquel le ruego, mautzi a eria: amad voſotros os ruego, mautzi em eriabu: amen aquellos les ruego, mautzi im eriabu. Paſſiva. Se tu amado, mautzi e eriaua: ſea aquel amado, mautzi eriaua: ſed voſotros amados os ſuplico, mautzi em eriauabu: ſean aquellos amados os ſuplico, mautzi im eriauabu.\n\nOptativo.\n198. Las notas, ó particulas optativas, que correſponden al utinam latino, y al ojala Eſpañol, ſon hau para los Tehuecos, y amatuc, larga la penultima, para las demás Naciones. Ponenſe ſiempre antecedentes al tiempo optativo en los dos modos que tienen de formarſe.\n\n199. Primero: hazeſe el optativo, añadiendo al verbo en lugar del naque del futuro eſta particula uaua, v. g. ojala me diera Dios vna manta de pita: [ejemplo cahíta; continúa].",
  "lineBreakPolicy":"Rule numbers and Optativo heading preserved; running prose normalized. Historical spelling retained.",
  "reviewStatus":"machine_corrected_unverified","humanVerified":false,
  "uncertainties":[{"token":"[ejemplo] / [forma]","note":"Cooking/pozole imperative example is not safely legible."},{"token":"amatuc","note":"Optative particle is visually strong but should be checked against adjacent uses for exact historical spelling."},{"token":"[ejemplo cahíta; continúa]","note":"Long example at foot continues on next page and is not reconstructed here."}],
  "materialNotes":[{"type":"bleed_through","note":"Moderate show-through; rule 198 is clearly readable.","transcription":null}],
  "provenance":{"derivedFrom":"ALC1737:digital-page-73;printed-page-59","agent":"GPT-5.6 Sol visual collation","method":"Full-page transcription with explicit uncertainty markers; no independent human verification","processedAt":null}
}