{
  "sourceId":"ALC1737","sourcePageDigital":123,"sourcePagePrinted":109,"section":"part_iv","transcriptionType":"diplomatic","coverage":"full_page","scope":"printed_text",
  "text":"[continuación de 343 — Adverbia situs] ... eſtá en cuclillas, rumua catec: recogido como ovillo, y cruzados los pies, [forma]: ſentado, y recogidos juntos los pies, [forma]: echado, y las piernas recogidas de lado, [forma]: aſſentado ſobre el pie, [formas]: los brazos abiertos en cruz, [formas]: los brazos cruzados ſobre el pecho, [forma]: el roſtro buelto á la pared, [forma]: los brazos apretados, [formas]: agachado, y encogido como quando ay frio, [forma]: tendidos muchos, [forma]: eſtán tendidos, [ejemplo]: en pie muchos ſin orden, [forma]: eſtán en pie, [ejemplo]: al ſoſlayo, [variantes], v. g. fué flechado al ſoſlayo, [ejemplo]: el cuerpo inclinado á vn lado, [forma]. Lo miſmo parece ſignificar [variantes]: no te arrimes delante del Padre, [ejemplo]: colgado deſigualmente de vn lado, [forma]: colgado como de vn hilo, [forma]: reclinado, [forma]: no te hinques de rodillas reclinado en ellas, [ejemplo]: inclinado con algun peſo, [formas].\n\nAdverbia motus.\n344. Sinuoſim, como quando la culebra ſe mueve atentadamente, [formas]: andar dando bueltas para caer, ó como baylanejo, [forma]: quando va cayendo vno en tierra, que va eſtendiendo las manos como para tenerſe, [forma]: andar, v. g. en quatro pies, [formas]: andar ſubiendo, y bajando, [forma]: andar trotando, [variantes]: andar con paſſos menudos, [variantes]: como vna pluma quando vuela por el ayre, [variantes]: ſalir en orden vno tras otro, [variantes]: ſalen de caſa de vno en vno como las abejas, [ejemplo]. Lo miſmo parece ſignificar [forma], v. g. de alli fuera ſalieron muchiſſimos [continúa].",
  "lineBreakPolicy":"Continuation of rule 343 and Adverbia motus rule 344 preserved; dense lists are not reconstructed where readings are insecure.",
  "reviewStatus":"unresolved","humanVerified":false,
  "uncertainties":[{"token":"Adverbia situs forms","note":"Dense posture vocabulary requires dedicated second collation before token-level production use."},{"token":"Adverbia motus forms","note":"Many motion-adverb forms are typographically dense and remain unresolved in this pass."}],
  "materialNotes":[{"type":"bleed_through","note":"Moderate show-through; thematic heading and rule transition are clear.","transcription":null}],
  "provenance":{"derivedFrom":"ALC1737:digital-page-123;printed-page-109","agent":"GPT-5.6 Sol visual collation","method":"Full-page structural/diplomatic transcription from facsimile with parsed text as secondary comparison; no independent human verification","processedAt":null}
}